{
  "schemaVersion": 2,
  "content_hash": "4cd527f9fc02f9fa4f9376b360a96b85",
  "metadata": {
    "file_path": "src/utils/hashing.ts",
    "file_name": "hashing.ts",
    "extension": ".ts",
    "line_count": 10,
    "byte_size": 317,
    "content_hash": "4cd527f9fc02f9fa4f9376b360a96b85",
    "generated_at": "2026-05-27T21:50:50.188Z",
    "generator": {
      "provider": "cloud",
      "model": "gpt-4o-mini"
    },
    "prompt_version": 1,
    "summary_format": "structured-functional-v1"
  },
  "summary": "## Metadata\n- File path: src/utils/hashing.ts\n- File name: hashing.ts\n- Extension: .ts\n- Inferred language/type: TypeScript\n- Content hash: 4cd527f9fc02f9fa4f9376b360a96b85\n- Line count: 10\n- Byte size: 317\n- Summary format: structured-functional-v1\n- Notable symbols/classes/functions: hashFileContent, hashTextContent\n- External dependencies: node:crypto\n- Internal dependencies: None identified.\n- Public API/exports: hashFileContent, hashTextContent\n\n## Purpose\nThis file provides utility functions for hashing file and text content using different algorithms.\n\n## User-Visible Behavior\nUsers can call the `hashFileContent` function to get an MD5 hash of a string representing file content, and the `hashTextContent` function to get a SHA-256 hash of a string representing text content.\n\n## Business Rules\nThe `hashFileContent` function uses the MD5 hashing algorithm, while the `hashTextContent` function uses the SHA-256 hashing algorithm. Both functions expect input as a string and return the hash as a hexadecimal string.\n\n## Data Inputs And Outputs\nThe `hashFileContent` function takes a string `fileContent` as input and outputs a string representing the MD5 hash. The `hashTextContent` function takes a string `textContent` as input and outputs a string representing the SHA-256 hash.\n\n## Side Effects\nNone identified.\n\n## Error And Edge Cases\nNone identified.\n\n## Dependencies\nThe file imports the `createHash` function from the `node:crypto` module to perform hashing operations.\n\n## Operational Notes\nNone identified."
}
