{
  "$schema": "https://raw.githubusercontent.com/sullyTheDev/diffdoc/main/schemas/v2/summary-asset.schema.json",
  "schemaVersion": 2,
  "content_hash": "f1a59de3664542a9e3660a9c3d752a2d",
  "metadata": {
    "file_path": "src/index.ts",
    "file_name": "index.ts",
    "extension": ".ts",
    "line_count": 181,
    "byte_size": 7701,
    "content_hash": "f1a59de3664542a9e3660a9c3d752a2d",
    "generated_at": "2026-05-27T22:03:33.749Z",
    "generator": {
      "provider": "cloud",
      "model": "gpt-4o-mini"
    },
    "prompt_version": 1,
    "summary_format": "structured-functional-v1"
  },
  "summary": "## Metadata\n- File path: src/index.ts\n- File name: index.ts\n- Extension: .ts\n- Inferred language/type: TypeScript\n- Content hash: f1a59de3664542a9e3660a9c3d752a2d\n- Line count: 181\n- Byte size: 7701\n- Summary format: structured-functional-v1\n- Notable symbols/classes/functions: Command, buildRuntimeConfig, runEmbed, runInit, runQuery, runSearch, runStatus, runSummarize\n- External dependencies: commander\n- Internal dependencies: ./config, ./commands/embed, ./commands/init, ./commands/query, ./commands/status, ./commands/summarize\n- Public API/exports: None identified.\n\n## Purpose\nThis file serves as the entry point for the DiffDoc CLI application, managing commands related to summarizing code changes, querying, embedding, and initializing configurations.\n\n## User-Visible Behavior\nUsers can interact with the CLI to execute commands such as initializing configurations, summarizing code, querying for information, searching through a local index, embedding summaries, and checking the status of manifests and indexes. Each command provides options for customization and outputs results or status information.\n\n## Business Rules\n- Users can specify configuration paths, AI providers, and various operational modes through command-line options.\n- The `summarize` command allows for different modes of summarization (all or delta) and includes options for handling code snapshots and output formats.\n- The `query` and `search` commands return a specified number of matches and can include code snapshots based on user input.\n- The `embed` command can rebuild the local index from scratch if specified.\n\n## Data Inputs And Outputs\n- Inputs include command-line arguments for configuration paths, AI provider types, and specific command options.\n- Outputs include JSON manifests, status reports, and console messages indicating success or error states.\n\n## Side Effects\nThe application may create or overwrite configuration files, generate summary manifests, and modify the local Vectra index based on user commands. It also logs errors to the console.\n\n## Error And Edge Cases\nThe application handles errors by catching exceptions during command execution and logging error messages to the console. It exits with a non-zero status code in case of errors. Edge cases include invalid paths, unsupported options, and network failures when interacting with external services.\n\n## Dependencies\n- External: The application relies on the `commander` package for command-line interface management.\n- Internal: It imports local modules for configuration management and command execution, including `./config` and various command files.\n\n## Operational Notes\nThe application is designed to run as a CLI tool and can handle asynchronous operations. It is important to ensure that the necessary environment variables and configuration files are set up correctly for optimal functionality. The application should be tested for concurrency when summarizing multiple files."
}
