{
  "$schema": "https://raw.githubusercontent.com/sullyTheDev/diffdoc/main/schemas/v2/summary-asset.schema.json",
  "schemaVersion": 2,
  "content_hash": "2979afbd26333c7dd18d635fc7000ea8",
  "metadata": {
    "file_path": "src/utils/scan.ts",
    "file_name": "scan.ts",
    "extension": ".ts",
    "line_count": 121,
    "byte_size": 3319,
    "content_hash": "2979afbd26333c7dd18d635fc7000ea8",
    "generated_at": "2026-05-29T17:58:39.955Z",
    "generator": {
      "provider": "cloud",
      "model": "gpt-5.4-mini-2026-03-17"
    },
    "prompt_version": 1,
    "summary_format": "structured-functional-v1"
  },
  "summary": "## Metadata\n- File path: src/utils/scan.ts\n- File name: scan.ts\n- Extension: .ts\n- Inferred language/type: TypeScript utility module for filesystem scanning and glob/ignore filtering\n- Content hash: 2979afbd26333c7dd18d635fc7000ea8\n- Line count: 121\n- Byte size: 3319\n- Summary format: structured-functional-v1\n- Notable symbols/classes/functions: normalizeRelativePath, normalizeGlobPattern, escapeRegex, globToRegExp, compileGlobs, shouldIncludeFile, isIgnoredDirectory, readIgnoreMatcher, walkCodeFiles\n- External dependencies: node:fs/promises, node:path, ignore\n- Internal dependencies: None identified.\n- Public API/exports: normalizeRelativePath, normalizeGlobPattern, compileGlobs, shouldIncludeFile, readIgnoreMatcher, walkCodeFiles\n\n## Purpose\nThis file provides helper functions for scanning a repository tree, normalizing path separators, converting glob patterns to regular expressions, loading ignore rules, and selecting which code files should be included in a scan.\n\n## User-Visible Behavior\n- Converts file paths and glob patterns to use forward slashes.\n- Compiles glob strings into regular expressions for matching.\n- Loads ignore rules from an ignore file if present.\n- Recursively walks a directory tree and returns matching file paths relative to the root.\n- Sorts the final list of discovered files before returning it.\n- Skips files and directories based on ignore rules, exclude patterns, and include patterns.\n\n## Business Rules\n- Path normalization always replaces platform-specific separators with `/`.\n- Glob compilation ignores empty patterns.\n- `**` matches across path segments, `*` matches within a single path segment, and `?` matches a single non-`/` character.\n- A file is excluded if the ignore matcher rejects it.\n- A file is excluded if it matches any exclude glob.\n- A file is included only if it matches at least one include glob when include globs are provided.\n- If no include globs are provided, all non-excluded, non-ignored files are eligible.\n- Directories are skipped when the ignore matcher rejects either the directory path or the same path with a trailing slash.\n- Missing ignore files are treated as non-fatal and result in an empty matcher.\n\n## Data Inputs And Outputs\n- Inputs:\n  - File and directory paths from the filesystem.\n  - Root repository path and current traversal path.\n  - Include and exclude glob pattern arrays.\n  - Ignore file path and repository path for resolving it.\n  - Ignore file contents, when present.\n- Outputs:\n  - Normalized path strings.\n  - Arrays of compiled regular expressions.\n  - A boolean decision from `shouldIncludeFile`.\n  - An `Ignore` matcher from `readIgnoreMatcher`.\n  - A sorted array of relative file paths from `walkCodeFiles`.\n\n## Side Effects\n- Reads files from disk to load ignore rules.\n- Reads directory contents recursively during scanning.\n- Resolves paths using the local filesystem layout.\n- Allocates and returns in-memory matcher and regex objects.\n\n## Error And Edge Cases\n- If the ignore file does not exist, `readIgnoreMatcher` returns an empty matcher instead of throwing.\n- Other filesystem errors from reading the ignore file are rethrown.\n- Directory traversal assumes `readdir` succeeds; failures propagate to the caller.\n- Empty include or exclude pattern strings are filtered out before compilation.\n- Relative paths for the root directory may be empty when normalizing the root itself.\n- The glob-to-regex conversion is limited to `*`, `**`, and `?` handling plus regex escaping for other special characters.\n\n## Dependencies\n- External:\n  - `node:fs/promises` for async file and directory access.\n  - `node:path` for path resolution and normalization.\n  - `ignore` package for `.gitignore`-style matching.\n- Internal:\n  - None identified.\n\n## Operational Notes\n- Traversal is recursive and sequential within each directory, which is simple but may be slower on very large trees.\n- Returned file paths are relative to `rootPath` and normalized to forward slashes, which helps keep results platform-independent.\n- Because results are sorted at the end, output order is deterministic regardless of filesystem enumeration order.\n- The ignore matcher is reusable across scans and should be loaded once when possible.\n- The regex conversion is custom and may not cover the full glob syntax supported by other glob libraries."
}
