{
  "$schema": "https://raw.githubusercontent.com/sullyTheDev/diffdoc/v0.6.0/schemas/summary-asset.schema.json",
  "schemaVersion": 2,
  "content_hash": "2108ea3e8be8c7090c23d660b6b4ecce",
  "metadata": {
    "file_path": "src/commands/init.ts",
    "file_name": "init.ts",
    "extension": ".ts",
    "line_count": 280,
    "byte_size": 10221,
    "content_hash": "2108ea3e8be8c7090c23d660b6b4ecce",
    "generated_at": "2026-05-29T15:48:31.709Z",
    "generator": {
      "provider": "cloud",
      "model": "gpt-5.4-mini-2026-03-17"
    },
    "prompt_version": 1,
    "summary_format": "structured-functional-v1"
  },
  "summary": "## Metadata\n- File path: src/commands/init.ts\n- File name: init.ts\n- Extension: .ts\n- Inferred language/type: TypeScript command module for CLI initialization\n- Content hash: 2108ea3e8be8c7090c23d660b6b4ecce\n- Line count: 280\n- Byte size: 10221\n- Summary format: structured-functional-v1\n- Notable symbols/classes/functions: InitOptions, DiffdocRc, InitSummary, DEFAULT_CONFIG, parseProvider, parseCsv, toDisplayPath, resolveRepoPath, relativeToRepo, normalizeRepoPattern, fileExists, readExistingConfig, promptText, promptBoolean, buildInteractiveConfig, buildYesConfig, writeJsonFile, buildStarterIgnore, createIgnoreFile, buildGitignoreEntries, updateGitignore, printList, runInit\n- External dependencies: node:fs/promises, node:path, node:readline/promises, node:process, package.json version field\n- Internal dependencies: None identified.\n- Public API/exports: runInit\n\n## Purpose\nThis file implements the `diffdoc init` command. It creates or updates DiffDoc configuration and ignore files, optionally prompting the user for setup values, and prints a summary plus next-step commands.\n\n## User-Visible Behavior\n- Creates a `.diffdocrc`-style JSON config file at the configured path.\n- Creates a starter ignore file if it does not already exist.\n- Updates `.gitignore` to exclude the DiffDoc vector store directory and the config file.\n- In interactive mode, prompts for provider, base directory, ignore file, include/exclude globs, and provider-specific settings.\n- In `--yes` mode, uses defaults and existing config values with minimal prompting.\n- Prints a completion message, a change summary, and suggested next commands.\n- If a target file already exists and `--force` is not set, it skips overwriting and reports a warning.\n\n## Business Rules\n- AI provider must be either `local` or `cloud`; any other value is rejected.\n- Existing config values are used as fallbacks when building the new config.\n- Default config values are applied when no existing value or prompt answer is provided.\n- `openaiApiKey` is only optionally collected for cloud provider setups; otherwise it is cleared to an empty string.\n- The ignore file defaults to `.diffdocignore` unless overridden in config or options.\n- The config file is not overwritten unless `force` is true.\n- The starter ignore file is only created if it does not already exist.\n- `.gitignore` entries are added only if missing; duplicates are avoided by line comparison.\n- The generated config schema URL is tied to the package version.\n\n## Data Inputs And Outputs\n- Inputs:\n  - CLI options: `yes`, `provider`, `config`, `baseDir`, `force`\n  - Existing config file contents, if present\n  - Interactive terminal input when `yes` is false\n  - Current working directory and repository-relative paths\n  - Package version from `package.json`\n- Outputs:\n  - JSON config file written to the configured path\n  - Ignore file written at the configured ignore path\n  - `.gitignore` updated with DiffDoc exclusions\n  - Console output summarizing actions and next steps\n- Data shapes:\n  - `DiffdocRc` config object\n  - `InitSummary` tracking created, updated, skipped, and warning entries\n\n## Side Effects\n- Reads and writes files on disk.\n- Creates directories as needed for config file output.\n- Modifies `.gitignore`.\n- Prompts on stdin/stdout in interactive mode.\n- Logs status and summary information to the console.\n\n## Error And Edge Cases\n- Invalid provider values throw an error.\n- Missing config file is treated as empty existing config.\n- Non-ENOENT errors while reading config or `.gitignore` are rethrown.\n- Existing config files that are not valid JSON will cause parsing to fail.\n- If a file already exists and `force` is false, it is skipped and a warning is recorded.\n- If `.gitignore` already contains the required entries, it is left unchanged and reported as skipped.\n- Path normalization handles platform separators and trims redundant slashes.\n- Interactive prompts fall back to existing values or defaults when the user submits empty input.\n\n## Dependencies\n- Node.js built-in modules:\n  - `node:fs/promises` for filesystem access\n  - `node:path` for path resolution and normalization\n  - `node:readline/promises` for interactive prompts\n  - `node:process` for stdin/stdout\n- `package.json` version field for schema URL construction\n- No internal project module imports are identified.\n\n## Operational Notes\n- The command is idempotent for `.gitignore` entries and the ignore file creation path, but config writing can overwrite when `force` is enabled.\n- Path handling is repository-relative and display output is normalized to forward slashes for consistency.\n- The generated config embeds a versioned schema URL, so package version changes affect new init output.\n- Interactive mode closes the readline interface in a `finally` block, reducing the risk of leaked terminal handles.\n- The summary output is useful for automation and debugging because it distinguishes created, updated, skipped, and warning states."
}
