{
  "$schema": "https://raw.githubusercontent.com/sullyTheDev/diffdoc/v0.6.0/schemas/summary-asset.schema.json",
  "schemaVersion": 2,
  "content_hash": "50212192abc450e8215513f06ceeb792",
  "metadata": {
    "file_path": "package.json",
    "file_name": "package.json",
    "extension": ".json",
    "line_count": 53,
    "byte_size": 1361,
    "content_hash": "50212192abc450e8215513f06ceeb792",
    "generated_at": "2026-05-29T15:48:12.377Z",
    "generator": {
      "provider": "cloud",
      "model": "gpt-5.4-mini-2026-03-17"
    },
    "prompt_version": 1,
    "summary_format": "structured-functional-v1"
  },
  "summary": "## Metadata\n- File path: package.json\n- File name: package.json\n- Extension: .json\n- Inferred language/type: JSON package manifest for a Node.js/CommonJS project\n- Content hash: 50212192abc450e8215513f06ceeb792\n- Line count: 53\n- Byte size: 1361\n- Summary format: structured-functional-v1\n- Notable symbols/classes/functions: name, version, description, license, author, homepage, bugs, repository, type, main, bin, files, engines, scripts, dependencies, devDependencies\n- External dependencies: @modelcontextprotocol/sdk, commander, ignore, openai, simple-git, vectra, zod, @types/node, typescript, zod-to-json-schema\n- Internal dependencies: dist/index.js, dist/mcp.js, dist/scripts/generate-schemas.js, dist, schemas, README.md, LICENSE, .diffdocrc.example\n- Public API/exports: CLI executables `diffdoc` and `diffdoc-mcp`; package main entry `dist/index.js`\n\n## Purpose\nDefines the Node.js package metadata, runtime requirements, published files, scripts, and dependency set for the `diffdoc` project. It configures the package as a CommonJS application with CLI entry points and build/prepare workflows.\n\n## User-Visible Behavior\nUsers installing the package get two command-line executables: `diffdoc` and `diffdoc-mcp`.\nRunning package scripts can:\n- build the project and generate schemas\n- regenerate schemas only\n- clean the `dist` directory\n- start the main application after compiling\n- run the build automatically during package preparation/publish lifecycle\n\nConsumers of the package will resolve the main module from `dist/index.js`.\n\n## Business Rules\n- The package name is `diffdoc` and the version is `0.6.0`.\n- The project is licensed under MIT.\n- The package is intended to run on Node.js `>=22`.\n- The package is treated as CommonJS via `\"type\": \"commonjs\"`.\n- Only the listed files are intended for package publication.\n- `prepare` must run `npm run build`.\n- `build` must compile TypeScript before generating schemas.\n- `start` must compile TypeScript before launching `dist/index.js`.\n- CLI command names are fixed to `diffdoc` and `diffdoc-mcp`.\n\n## Data Inputs And Outputs\nInputs:\n- Package metadata fields in this JSON file\n- Build/runtime scripts referenced in `scripts`\n- Dependency declarations for runtime and development tooling\n\nOutputs:\n- npm package metadata used for installation and publication\n- CLI binaries mapped to built JavaScript files\n- Main module resolution to `dist/index.js`\n- Build artifacts expected under `dist`\n- Generated schema artifacts expected under `schemas`\n\n## Side Effects\n- `build` compiles TypeScript and runs schema generation.\n- `generate:schemas` runs the schema generation script.\n- `clean` deletes the `dist` directory recursively and forcefully.\n- `start` compiles TypeScript and then executes the built app.\n- `prepare` triggers the build during npm lifecycle events.\n\n## Error And Edge Cases\n- If Node.js is below version 22, the package declares itself unsupported.\n- If `dist/index.js` or `dist/mcp.js` is missing, the CLI binaries will not resolve correctly.\n- If TypeScript compilation fails, `build`, `start`, and `prepare` fail.\n- If schema generation fails, `build` and `generate:schemas` fail.\n- `clean` is forceful and may remove `dist` even if it contains stale or partially built artifacts.\n- Package consumers relying on files outside the `files` allowlist may not receive them in published installs.\n\n## Dependencies\nExternal:\n- `@modelcontextprotocol/sdk` for MCP-related functionality\n- `commander` for CLI parsing\n- `ignore` for ignore-pattern handling\n- `openai` for model/API integration\n- `simple-git` for Git repository interaction\n- `vectra` for vector storage/indexing\n- `zod` for schema validation\n- `typescript` and `@types/node` for development/build tooling\n- `zod-to-json-schema` for schema conversion\n\nInternal:\n- Built outputs in `dist/index.js`, `dist/mcp.js`, and `dist/scripts/generate-schemas.js`\n- Published schema assets under `schemas`\n- Repository documentation and example config files listed in `files`\n\n## Operational Notes\n- The package is configured for a compiled distribution model rather than direct source execution.\n- `prepare` ensures builds happen automatically in install/publish workflows, which can increase install time.\n- The `files` allowlist suggests the published artifact set is intentionally limited to build outputs and supporting docs/config examples.\n- Schema generation is part of the normal build path, so schema drift should be addressed by rerunning the build.\n- The CLI entry points depend on successful TypeScript compilation into `dist`."
}
