{
  "$schema": "https://raw.githubusercontent.com/sullyTheDev/diffdoc/main/schemas/v2/summary-asset.schema.json",
  "schemaVersion": 2,
  "content_hash": "680c48641728a7fc034743eefb3e5178",
  "metadata": {
    "file_path": "src/commands/summarize.ts",
    "file_name": "summarize.ts",
    "extension": ".ts",
    "line_count": 616,
    "byte_size": 20366,
    "content_hash": "680c48641728a7fc034743eefb3e5178",
    "generated_at": "2026-05-29T17:58:21.849Z",
    "generator": {
      "provider": "cloud",
      "model": "gpt-5.4-mini-2026-03-17"
    },
    "prompt_version": 1,
    "summary_format": "structured-functional-v1"
  },
  "summary": "## Metadata\n- File path: src/commands/summarize.ts\n- File name: summarize.ts\n- Extension: .ts\n- Inferred language/type: TypeScript command module for repository summarization\n- Content hash: 680c48641728a7fc034743eefb3e5178\n- Line count: 616\n- Byte size: 20366\n- Summary format: structured-functional-v1\n- Notable symbols/classes/functions: SummarizeOptions, SummarizeTotals, SummaryFreshnessExpected, SummarizeReport, getSummaryDir, getSummaryPath, atomicWriteUtf8, writeManifest, writeSummaryAsset, getPromptHash, buildSummaryMetadata, isRecord, hasExpectedCustomPromptHash, isSummaryAssetFresh, readManifest, countHashRefs, deleteSummaryIfUnreferenced, setManifestPathHash, removeManifestPath, ensureSummaryAsset, runWithConcurrency, createManifestLock, pruneOrphanedSummaries, runSummarize\n- External dependencies: node:fs/promises, node:path, RuntimeConfig, ../config, ../types/artifacts, ../schemas, ../utils/git, ../utils/hashing, ../utils/llm, ../utils/paths, ../utils/scan\n- Internal dependencies: MANIFEST_SCHEMA_VERSION, SUMMARY_ASSET_SCHEMA_VERSION, RepoManifestSchema, RepoManifest, SummaryAsset, SummaryMetadata, SCHEMA_BASE_URL, getCurrentCommit, getGitDeltas, hashFileContent, hashTextContent, generateFunctionalSummary, SUMMARY_FORMAT, SUMMARY_PROMPT_VERSION, resolveDiffdocArtifactPath, normalizeGlobPattern, compileGlobs, shouldIncludeFile, readIgnoreMatcher, walkCodeFiles\n- Public API/exports: runSummarize\n\n## Purpose\nThis file implements the summarize command for a diffdoc-style repository summarization workflow. It scans source files, generates or refreshes per-file functional summaries, maintains a manifest of file-to-content-hash mappings, and prunes summaries that are no longer referenced.\n\n## User-Visible Behavior\n- In `all` mode, scans all eligible code files under the target repository path and generates summaries for each file.\n- In `delta` mode, inspects Git deltas since the last synced commit and processes only modified/added/deleted files.\n- Prints progress and completion information to stdout when JSON mode is disabled.\n- Emits a JSON report to stdout when `json` is enabled.\n- Reports per-file failures and throws a final error if any file failed during summarization.\n- Creates or updates a manifest file and summary JSON artifacts on disk.\n- Deletes summary artifacts that are no longer referenced by the manifest.\n\n## Business Rules\n- Only `all` and `delta` are valid summarize modes.\n- File inclusion is controlled by include globs, exclude globs, and an ignore file matcher; CLI options override config defaults when provided.\n- Summary freshness depends on:\n  - matching content hash,\n  - matching schema version,\n  - matching prompt version,\n  - matching summary format,\n  - matching generator provider/model,\n  - matching custom prompt hash when present,\n  - matching whether code snapshot inclusion is enabled.\n- In `all` mode, the manifest file is reset before processing begins.\n- In `delta` mode:\n  - deleted files are removed from the manifest and may trigger summary pruning,\n  - excluded modified files are removed from the manifest if present,\n  - unchanged files may be refreshed only if their summary is stale or `refresh` is enabled.\n- Summary assets are deduplicated by content hash; multiple files can reference the same summary artifact.\n- Orphaned summary JSON files are removed after processing.\n- Manifest updates are serialized through a lock to avoid concurrent writes.\n\n## Data Inputs And Outputs\n- Inputs:\n  - `SummarizeOptions` values: repository path, output path, mode, code snapshot flag, JSON flag, include/exclude globs, ignore file, refresh flag.\n  - `RuntimeConfig` values: repo path, base directory, provider, chat model, summarize settings, resolved prompt, concurrency, default globs, ignore file.\n  - Git state from the target repository.\n  - File contents from scanned source files.\n  - Existing manifest and summary JSON artifacts, if present.\n- Outputs:\n  - Updated manifest JSON at the resolved artifact path.\n  - Per-hash summary JSON files in a `summaries` directory.\n  - Optional JSON report on stdout.\n  - Console progress and completion logs when not in JSON mode.\n  - Final thrown error if any file-level failures occurred.\n- Derived data:\n  - content hashes from file text,\n  - prompt hash from resolved summary prompt,\n  - metadata including file name, extension, line count, byte size, and generator details.\n\n## Side Effects\n- Reads and writes files on disk.\n- Creates directories as needed for manifest and summary writes.\n- Writes manifest and summary files atomically via temporary files and rename.\n- Deletes unreferenced summary files.\n- Reads Git state and current commit from the repository.\n- Logs progress, errors, and completion summaries to stdout/stderr.\n- Mutates in-memory manifest state and reference counts during execution.\n\n## Error And Edge Cases\n- Rejects unsupported summarize modes immediately.\n- Treats missing manifest files as an empty manifest with schema metadata.\n- Treats unreadable or malformed summary files as stale and regenerates them.\n- Validates manifest structure with schema parsing and throws detailed validation errors on invalid manifests.\n- Handles missing files in delta mode by pruning them from the manifest instead of failing the run.\n- Ignores missing summary files during orphan cleanup.\n- Records per-file failures and continues processing other files.\n- Throws a final error after reporting if any failures occurred.\n- If a summary asset is stale or mismatched on freshness checks, it is regenerated.\n- If a file is excluded in delta mode, it may be removed from the manifest rather than summarized.\n\n## Dependencies\n- Node.js filesystem promises API for reading, writing, syncing, renaming, listing, and deleting files.\n- Node.js path utilities for path resolution and basename/extension extraction.\n- `RuntimeConfig` from the local config module.\n- Artifact schemas and schema versions from `../types/artifacts`.\n- Schema base URL from `../schemas`.\n- Git utilities for current commit and delta detection.\n- Hashing utilities for file content and prompt text.\n- LLM summary generation utilities for producing functional summaries.\n- Path resolution helper for locating diffdoc artifact output.\n- Scan utilities for glob normalization, glob compilation, file inclusion checks, ignore-file parsing, and code-file walking.\n\n## Operational Notes\n- Concurrency is applied to file processing, but manifest writes are serialized to avoid corruption.\n- Summary generation is deduplicated by content hash, reducing repeated LLM calls for identical file content.\n- Atomic write behavior reduces the chance of partially written manifest or summary files.\n- The command is designed to be rerunnable and incremental, especially in delta mode.\n- Refresh behavior is controlled by both the `refresh` option and freshness checks against prompt/model/format metadata.\n- The final manifest commit marker is updated to the repository’s current commit after processing.\n- Orphan pruning happens after manifest updates, so summary cleanup reflects the final manifest state.\n- JSON mode suppresses human-readable progress logs and emits a machine-readable report instead.\n- The file includes custom prompt hashing/source tracking, which affects freshness and regeneration decisions."
}
