{
  "schemaVersion": 2,
  "content_hash": "596c9d4843d8e9b8e6636f3ec3af6ffe",
  "metadata": {
    "file_path": "src/commands/embed.ts",
    "file_name": "embed.ts",
    "extension": ".ts",
    "line_count": 182,
    "byte_size": 6101,
    "content_hash": "596c9d4843d8e9b8e6636f3ec3af6ffe",
    "generated_at": "2026-05-27T21:49:43.686Z",
    "generator": {
      "provider": "cloud",
      "model": "gpt-4o-mini"
    },
    "prompt_version": 1,
    "summary_format": "structured-functional-v1"
  },
  "summary": "## Metadata\n- File path: src/commands/embed.ts\n- File name: embed.ts\n- Extension: .ts\n- Inferred language/type: TypeScript\n- Content hash: 596c9d4843d8e9b8e6636f3ec3af6ffe\n- Line count: 182\n- Byte size: 6101\n- Summary format: structured-functional-v1\n- Notable symbols/classes/functions: runEmbed, getVectraIndexPath, readManifest, readSummaryAsset, buildDocument\n- External dependencies: fs (node:fs/promises), path (node:path), vectra (LocalIndex, MetadataTypes), ../types/artifacts (RepoManifest, SummaryAsset, MANIFEST_SCHEMA_VERSION, SUMMARY_ASSET_SCHEMA_VERSION), ../utils/llm (generateEmbeddings), ../utils/paths (getDiffdocBaseDir, resolveDiffdocArtifactPath)\n- Internal dependencies: None identified.\n- Public API/exports: runEmbed, getVectraIndexPath\n\n## Purpose\nThis file is responsible for embedding summaries into a vector index, managing the reading of manifest and summary assets, and updating the index based on changes in the summaries.\n\n## User-Visible Behavior\nUsers will observe the embedding of summaries into a vector index, with console logs indicating the number of summaries embedded and items pruned. If the index is already up to date, a message will confirm this.\n\n## Business Rules\n- The manifest must adhere to a specific schema version; otherwise, an error is thrown.\n- Summary assets must have valid schema versions and content hashes; invalid assets result in errors.\n- The index can be rebuilt based on the `rebuild` option, which determines whether to delete existing items or not.\n\n## Data Inputs And Outputs\n- Inputs: \n  - `options` (EmbedOptions) containing the manifest path and rebuild flag.\n  - `config` (RuntimeConfig) for base directory and embedding configurations.\n- Outputs: \n  - Updates to the vector index with embedded summaries and metadata.\n  - Console logs summarizing the operation results.\n\n## Side Effects\nThe function modifies the local vector index by adding, updating, or deleting items based on the summaries processed. It also reads from the filesystem to access manifest and summary files.\n\n## Error And Edge Cases\n- Errors are thrown for unsupported schema versions in manifests and summary assets.\n- Hash mismatches between summary assets and their expected values will result in errors.\n- If no summaries need to be updated or deleted, the function will log that the index is already up to date.\n\n## Dependencies\n- External packages: `fs/promises` for file operations, `path` for path manipulations, `vectra` for local indexing functionalities.\n- Internal utilities: Functions for generating embeddings and resolving paths.\n\n## Operational Notes\nThe function handles batch processing of embeddings based on a configurable batch size. It ensures that updates to the index are atomic, with rollback capabilities in case of errors during the update process."
}
