{
  "$schema": "https://raw.githubusercontent.com/sullyTheDev/diffdoc/main/schemas/v2/summary-asset.schema.json",
  "schemaVersion": 2,
  "content_hash": "11af7ad818b0d8f9a44f46a939c2936b",
  "metadata": {
    "file_path": "LICENSE",
    "file_name": "LICENSE",
    "extension": "",
    "line_count": 22,
    "byte_size": 1098,
    "content_hash": "11af7ad818b0d8f9a44f46a939c2936b",
    "generated_at": "2026-05-27T21:49:19.358Z",
    "generator": {
      "provider": "cloud",
      "model": "gpt-4o-mini"
    },
    "prompt_version": 1,
    "summary_format": "structured-functional-v1"
  },
  "summary": "## Metadata\n- File path: LICENSE\n- File name: LICENSE\n- Extension: None\n- Inferred language/type: License document\n- Content hash: 11af7ad818b0d8f9a44f46a939c2936b\n- Line count: 22\n- Byte size: 1098\n- Summary format: structured-functional-v1\n- Notable symbols/classes/functions: None identified.\n- External dependencies: None identified.\n- Internal dependencies: None identified.\n- Public API/exports: None identified.\n\n## Purpose\nThis file serves as the legal document outlining the terms under which the software can be used, modified, and distributed, specifically under the MIT License.\n\n## User-Visible Behavior\nUsers who obtain this software will see that they are granted permission to use, copy, modify, merge, publish, distribute, sublicense, and sell copies of the software, provided they include the copyright notice and permission notice in all copies.\n\n## Business Rules\nThe software is provided \"as is\" without any warranties, and the authors are not liable for any claims or damages arising from its use.\n\n## Data Inputs And Outputs\nThere are no data inputs or outputs in the traditional sense; instead, the document outlines the permissions and limitations regarding the software's use.\n\n## Side Effects\nNone identified.\n\n## Error And Edge Cases\nNone identified.\n\n## Dependencies\nNone identified.\n\n## Operational Notes\nNone identified."
}
