{
  "$schema": "https://raw.githubusercontent.com/sullyTheDev/diffdoc/v0.6.0/schemas/summary-asset.schema.json",
  "schemaVersion": 2,
  "content_hash": "ada06088c29fb32a8f41e7c26c68ab3d",
  "metadata": {
    "file_path": "src/commands/validate.ts",
    "file_name": "validate.ts",
    "extension": ".ts",
    "line_count": 132,
    "byte_size": 4302,
    "content_hash": "ada06088c29fb32a8f41e7c26c68ab3d",
    "generated_at": "2026-05-29T15:48:45.645Z",
    "generator": {
      "provider": "cloud",
      "model": "gpt-5.4-mini-2026-03-17"
    },
    "prompt_version": 1,
    "summary_format": "structured-functional-v1"
  },
  "summary": "## Metadata\n- File path: src/commands/validate.ts\n- File name: validate.ts\n- Extension: .ts\n- Inferred language/type: TypeScript command module for validation logic\n- Content hash: ada06088c29fb32a8f41e7c26c68ab3d\n- Line count: 132\n- Byte size: 4302\n- Summary format: structured-functional-v1\n- Notable symbols/classes/functions: ValidateOptions, ValidationIssue, ValidationReport, getSummaryDir, runValidate\n- External dependencies: node:fs/promises, node:path, process, RepoManifestSchema, SummaryAssetSchema, resolveDiffdocArtifactPath\n- Internal dependencies: ../config, ../types/artifacts, ../utils/paths\n- Public API/exports: ValidateOptions, runValidate\n\n## Purpose\nImplements the `validate` command for DiffDoc artifacts. It loads a manifest, validates it against the repository manifest schema, then validates each referenced summary asset JSON file and reports schema/content consistency.\n\n## User-Visible Behavior\n- Reads a manifest file resolved relative to the configured base directory.\n- Prints either:\n  - a JSON validation report when `options.json` is true, or\n  - a human-readable summary with manifest status, summary asset counts, and issue details.\n- Sets the process exit code to `1` when validation fails.\n- Reports missing files, JSON parse failures, and schema validation issues.\n\n## Business Rules\n- The manifest must parse as JSON and satisfy `RepoManifestSchema`.\n- Only if the manifest is valid does the command proceed to validate referenced summary assets.\n- Summary assets are checked by unique hash values derived from `result.data.files`.\n- Each referenced summary asset is expected at `summaries/{hash}.json` relative to the manifest directory.\n- Each summary asset must satisfy `SummaryAssetSchema`.\n- A summary asset’s `content_hash` must exactly match the filename-derived hash.\n- Overall validation is considered valid only when the manifest is valid and no issues were recorded.\n\n## Data Inputs And Outputs\n- Inputs:\n  - `options.manifest`: manifest path or artifact reference.\n  - `options.json`: toggles JSON vs human-readable output.\n  - `config.baseDir`: base directory used to resolve artifact paths.\n  - Manifest JSON file contents.\n  - Summary asset JSON file contents.\n- Outputs:\n  - Console output via `console.log`.\n  - JSON report object when `options.json` is enabled.\n  - Process exit code set to `1` on failure.\n- Report fields:\n  - `valid`\n  - `manifestPath`\n  - `manifestValid`\n  - `summaryAssetsChecked`\n  - `summaryAssetsValid`\n  - `issues`\n\n## Side Effects\n- Reads files from disk using `fs.readFile`.\n- Writes validation results to standard output.\n- Mutates `process.exitCode` on failure.\n\n## Error And Edge Cases\n- Missing manifest file produces a `Manifest file not found.` issue.\n- Manifest JSON parse failures produce a `Failed to parse JSON: ...` issue.\n- Invalid manifest schema produces schema issue entries from `RepoManifestSchema`.\n- Missing summary asset files produce a `Summary asset file not found.` issue.\n- Summary asset JSON parse failures produce a `Failed to parse JSON: ...` issue.\n- Invalid summary asset schema produces schema issue entries from `SummaryAssetSchema`.\n- A summary asset with a mismatched `content_hash` is reported as an issue even if schema validation succeeds.\n- Duplicate hashes in the manifest are deduplicated via `Set`, so each unique hash is checked once.\n- If the manifest cannot be parsed or validated, summary asset validation is skipped.\n- `report.valid` is false whenever any issue exists or the manifest is invalid.\n\n## Dependencies\n- Node.js `fs/promises` for asynchronous file reads.\n- Node.js `path` for path resolution.\n- `resolveDiffdocArtifactPath` for resolving the manifest path.\n- `RepoManifestSchema` and `SummaryAssetSchema` for schema validation.\n- `RuntimeConfig` type from the local config module.\n- `process.exitCode` and `console.log` from the Node.js runtime.\n\n## Operational Notes\n- Validation is sequential, not parallel, which simplifies reporting but may be slower for many assets.\n- The command is idempotent with respect to filesystem state; it only reads files and reports results.\n- The summary directory is derived from the manifest location, so moving the manifest changes where referenced assets are expected.\n- JSON output is pretty-printed with two-space indentation, which is useful for tooling and debugging.\n- Because `process.exitCode` is set rather than exiting immediately, callers can still perform cleanup after invocation."
}
