{
  "$schema": "https://raw.githubusercontent.com/sullyTheDev/diffdoc/main/schemas/v2/summary-asset.schema.json",
  "schemaVersion": 2,
  "content_hash": "473871ec28debd2c2d4ec7ac3a858d33",
  "metadata": {
    "file_path": "schemas/v2/summary-asset.schema.json",
    "file_name": "summary-asset.schema.json",
    "extension": ".json",
    "line_count": 104,
    "byte_size": 2552,
    "content_hash": "473871ec28debd2c2d4ec7ac3a858d33",
    "generated_at": "2026-05-29T16:11:59.752Z",
    "generator": {
      "provider": "cloud",
      "model": "gpt-4o-mini"
    },
    "prompt_version": 1,
    "summary_format": "structured-functional-v1"
  },
  "summary": "## Metadata\n- File path: schemas/v2/summary-asset.schema.json\n- File name: summary-asset.schema.json\n- Extension: .json\n- Inferred language/type: JSON Schema\n- Content hash: 473871ec28debd2c2d4ec7ac3a858d33\n- Line count: 104\n- Byte size: 2552\n- Summary format: structured-functional-v1\n- Notable symbols/classes/functions: None identified.\n- External dependencies: None identified.\n- Internal dependencies: None identified.\n- Public API/exports: None identified.\n\n## Purpose\nThis file defines a JSON schema for a summary asset, which outlines the structure and requirements for metadata related to files, including their properties and content.\n\n## User-Visible Behavior\nUsers or systems validating against this schema would receive validation errors if the provided data does not conform to the defined structure, such as missing required fields or incorrect data types.\n\n## Business Rules\nThe schema enforces rules such as:\n- The `schemaVersion` must be a constant value of 2.\n- Required fields include `file_path`, `file_name`, `extension`, `line_count`, `byte_size`, `content_hash`, `generated_at`, `generator`, `prompt_version`, and `summary_format`.\n- The `generator` object must contain both `provider` and `model` as required properties.\n\n## Data Inputs And Outputs\nInputs to this schema include JSON objects that represent summary assets. Outputs consist of validation results indicating whether the input data is valid or detailing the errors found.\n\n## Side Effects\nNone identified.\n\n## Error And Edge Cases\nValidation errors may occur if:\n- Required fields are missing.\n- Data types do not match the expected types (e.g., string vs. number).\n- Additional properties are included that are not defined in the schema.\n\n## Dependencies\nNone identified.\n\n## Operational Notes\nThis schema follows the JSON Schema Draft 07 specification, which should be considered when implementing validation logic. It is designed to ensure that summary assets are consistently structured and contain all necessary information for processing."
}
