{
  "$schema": "https://raw.githubusercontent.com/sullyTheDev/diffdoc/main/schemas/v2/summary-asset.schema.json",
  "schemaVersion": 2,
  "content_hash": "03df2f2f99a7bd6e3822b09e0f1dbbda",
  "metadata": {
    "file_path": ".github/workflows/diffdoc-summarize.yml",
    "file_name": "diffdoc-summarize.yml",
    "extension": ".yml",
    "line_count": 73,
    "byte_size": 2398,
    "content_hash": "03df2f2f99a7bd6e3822b09e0f1dbbda",
    "generated_at": "2026-05-29T16:11:31.056Z",
    "generator": {
      "provider": "cloud",
      "model": "gpt-4o-mini"
    },
    "prompt_version": 1,
    "summary_format": "structured-functional-v1"
  },
  "summary": "## Metadata\n- File path: .github/workflows/diffdoc-summarize.yml\n- File name: diffdoc-summarize.yml\n- Extension: .yml\n- Inferred language/type: YAML (GitHub Actions workflow)\n- Content hash: 03df2f2f99a7bd6e3822b09e0f1dbbda\n- Line count: 73\n- Byte size: 2398\n- Summary format: structured-functional-v1\n- Notable symbols/classes/functions: None identified.\n- External dependencies: actions/checkout@v4, actions/setup-node@v4\n- Internal dependencies: None identified.\n- Public API/exports: None identified.\n\n## Purpose\nThis file defines a GitHub Actions workflow that automatically updates the DiffDoc manifest and summaries when changes are pushed to the main branch.\n\n## User-Visible Behavior\nUsers will observe the automatic updating of the DiffDoc manifest and summaries in the repository after a push to the main branch, provided there are changes to the relevant files. If no changes are detected, a message will indicate that there are no changes to commit.\n\n## Business Rules\nThe workflow triggers on pushes to the main branch, ignoring specific paths. It requires certain environment variables and secrets to be set for proper execution. The workflow will only commit changes if there are modifications to the DiffDoc artifacts.\n\n## Data Inputs And Outputs\nInputs include environment variables for AI provider configurations and paths to the DiffDoc directory. Outputs include the updated DiffDoc manifest and summaries committed back to the repository.\n\n## Side Effects\nThe workflow writes changes to the DiffDoc manifest and summaries in the repository, potentially triggering further workflows or actions based on these updates.\n\n## Error And Edge Cases\nIf there are no changes to the DiffDoc artifacts, the workflow will exit gracefully without attempting to commit. Errors in validation or during the build process could prevent the workflow from completing successfully.\n\n## Dependencies\nThe workflow depends on the GitHub Actions for checking out the repository and setting up Node.js. It also relies on Node.js scripts for building and validating the DiffDoc artifacts.\n\n## Operational Notes\nThe workflow runs on an Ubuntu environment and is set to not cancel in-progress jobs. It uses caching for npm dependencies to improve performance. The concurrency group ensures that multiple runs do not interfere with each other."
}
