{
  "$schema": "https://raw.githubusercontent.com/sullyTheDev/diffdoc/main/schemas/v2/summary-asset.schema.json",
  "schemaVersion": 2,
  "content_hash": "74ae927421e31324d92d9b84727470d6",
  "metadata": {
    "file_path": "src/commands/query.ts",
    "file_name": "query.ts",
    "extension": ".ts",
    "line_count": 68,
    "byte_size": 2095,
    "content_hash": "74ae927421e31324d92d9b84727470d6",
    "generated_at": "2026-05-29T16:12:11.164Z",
    "generator": {
      "provider": "cloud",
      "model": "gpt-4o-mini"
    },
    "prompt_version": 1,
    "summary_format": "structured-functional-v1"
  },
  "summary": "## Metadata\n- File path: src/commands/query.ts\n- File name: query.ts\n- Extension: .ts\n- Inferred language/type: TypeScript\n- Content hash: 74ae927421e31324d92d9b84727470d6\n- Line count: 68\n- Byte size: 2095\n- Summary format: structured-functional-v1\n- Notable symbols/classes/functions: runQuery, runSearch, QueryOptions, SearchOptions\n- External dependencies: None identified.\n- Internal dependencies: RuntimeConfig, answerFromIndex, parseTopK, searchIndex, trimForDisplay\n- Public API/exports: runQuery, runSearch\n\n## Purpose\nThis file implements functionality for querying and searching an index based on user-provided messages and options, facilitating retrieval of relevant answers and sources.\n\n## User-Visible Behavior\nUsers can invoke the `runQuery` and `runSearch` functions, which will output answers, sources, and summaries to the console. The output varies based on the options provided, such as whether to include code snapshots.\n\n## Business Rules\n- The `top` option determines how many top results to retrieve.\n- If no sources are found, a message indicating this is logged.\n- If the `code` option is false, code snapshots are not displayed in the output.\n- The results are formatted with scores and hashes for clarity.\n\n## Data Inputs And Outputs\n- Inputs: \n  - `message`: a string representing the query or search term.\n  - `options`: an object containing `top` (string) and `code` (boolean).\n  - `config`: a `RuntimeConfig` object for configuration settings.\n- Outputs: \n  - Console logs displaying answers, sources, scores, hashes, summaries, and optionally code snapshots.\n\n## Side Effects\nThe functions log output to the console, which includes answers, sources, and other relevant information based on the query or search results.\n\n## Error And Edge Cases\n- If no results are found during a search, a specific message is logged.\n- If the `top` option is invalid or results in no data, the behavior is not explicitly handled in the code.\n\n## Dependencies\n- Imported types and functions from local modules: `RuntimeConfig`, `answerFromIndex`, `parseTopK`, `searchIndex`, `trimForDisplay`.\n\n## Operational Notes\n- The functions are asynchronous and return promises, which should be awaited when called.\n- The `trimForDisplay` function is used to limit the length of displayed summaries and code snapshots, ensuring console output remains manageable."
}
